
*** Running vivado
    with args -log design_1_pl_sysref_0_0.vds -m64 -product Vivado -mode batch -messageDb vivado.pb -notrace -source design_1_pl_sysref_0_0.tcl


****** Vivado v2019.2 (64-bit)
  **** SW Build 2708876 on Wed Nov  6 21:39:14 MST 2019
  **** IP Build 2700528 on Thu Nov  7 00:09:20 MST 2019
    ** Copyright 1986-2019 Xilinx, Inc. All Rights Reserved.

source design_1_pl_sysref_0_0.tcl -notrace
Command: synth_design -top design_1_pl_sysref_0_0 -part xczu28dr-ffvg1517-2-e -mode out_of_context
Starting synth_design
WARNING: [IP_Flow 19-3571] IP 'design_1_pl_sysref_0_0' is restricted:
* Module reference is stale and needs refreshing.
Attempting to get a license for feature 'Synthesis' and/or device 'xczu28dr'
INFO: [Common 17-349] Got license for feature 'Synthesis' and/or device 'xczu28dr'
INFO: [Common 17-1540] The version limit for your license is '2020.05' and has expired for new software. A version limit expiration means that, although you may be able to continue to use the current version of tools or IP with this license, you will not be eligible for any updates or new releases.
INFO: [Device 21-403] Loading part xczu28dr-ffvg1517-2-e
INFO: Launching helper process for spawning children vivado processes
INFO: Helper process launched with PID 293824 
load diablo GTM unisim library
---------------------------------------------------------------------------------
Starting RTL Elaboration : Time (s): cpu = 00:00:02 ; elapsed = 00:00:05 . Memory (MB): peak = 2468.453 ; gain = 147.719 ; free physical = 37377 ; free virtual = 106960
---------------------------------------------------------------------------------
INFO: [Synth 8-6157] synthesizing module 'design_1_pl_sysref_0_0' [/home/wisig/Videos/MTS/RFSoC-MTS/mts/mts.srcs/sources_1/bd/design_1/ip/design_1_pl_sysref_0_0/synth/design_1_pl_sysref_0_0.v:58]
INFO: [Synth 8-6157] synthesizing module 'pl_sysref' [/home/wisig/Videos/MTS/RFSoC-MTS/mts/mts.srcs/sources_1/imports/hdl/pl_sysref.v:2]
INFO: [Synth 8-5534] Detected attribute (* dont_touch = "true" *) [/home/wisig/Videos/MTS/RFSoC-MTS/mts/mts.srcs/sources_1/imports/hdl/pl_sysref.v:15]
INFO: [Synth 8-5534] Detected attribute (* dont_touch = "true" *) [/home/wisig/Videos/MTS/RFSoC-MTS/mts/mts.srcs/sources_1/imports/hdl/pl_sysref.v:16]
INFO: [Synth 8-5534] Detected attribute (* dont_touch = "true" *) [/home/wisig/Videos/MTS/RFSoC-MTS/mts/mts.srcs/sources_1/imports/hdl/pl_sysref.v:17]
INFO: [Synth 8-5534] Detected attribute (* dont_touch = "true" *) [/home/wisig/Videos/MTS/RFSoC-MTS/mts/mts.srcs/sources_1/imports/hdl/pl_sysref.v:18]
INFO: [Synth 8-5534] Detected attribute (* dont_touch = "true" *) [/home/wisig/Videos/MTS/RFSoC-MTS/mts/mts.srcs/sources_1/imports/hdl/pl_sysref.v:19]
INFO: [Synth 8-6157] synthesizing module 'IBUFDS' [/home/wisig/xilinx_19_2/Vivado/2019.2/scripts/rt/data/unisim_comp_diablo.v:32952]
	Parameter CAPACITANCE bound to: DONT_CARE - type: string 
	Parameter DIFF_TERM bound to: FALSE - type: string 
	Parameter DQS_BIAS bound to: FALSE - type: string 
	Parameter IBUF_DELAY_VALUE bound to: 0 - type: string 
	Parameter IBUF_LOW_PWR bound to: TRUE - type: string 
	Parameter IFD_DELAY_VALUE bound to: AUTO - type: string 
	Parameter IOSTANDARD bound to: DEFAULT - type: string 
INFO: [Synth 8-6155] done synthesizing module 'IBUFDS' (1#1) [/home/wisig/xilinx_19_2/Vivado/2019.2/scripts/rt/data/unisim_comp_diablo.v:32952]
INFO: [Synth 8-6157] synthesizing module 'IDDRE1' [/home/wisig/xilinx_19_2/Vivado/2019.2/scripts/rt/data/unisim_comp_diablo.v:34944]
	Parameter DDR_CLK_EDGE bound to: OPPOSITE_EDGE - type: string 
	Parameter IS_CB_INVERTED bound to: 1'b0 
	Parameter IS_C_INVERTED bound to: 1'b0 
INFO: [Synth 8-6155] done synthesizing module 'IDDRE1' (2#1) [/home/wisig/xilinx_19_2/Vivado/2019.2/scripts/rt/data/unisim_comp_diablo.v:34944]
INFO: [Synth 8-6155] done synthesizing module 'pl_sysref' (3#1) [/home/wisig/Videos/MTS/RFSoC-MTS/mts/mts.srcs/sources_1/imports/hdl/pl_sysref.v:2]
INFO: [Synth 8-6155] done synthesizing module 'design_1_pl_sysref_0_0' (4#1) [/home/wisig/Videos/MTS/RFSoC-MTS/mts/mts.srcs/sources_1/bd/design_1/ip/design_1_pl_sysref_0_0/synth/design_1_pl_sysref_0_0.v:58]
---------------------------------------------------------------------------------
Finished RTL Elaboration : Time (s): cpu = 00:00:03 ; elapsed = 00:00:06 . Memory (MB): peak = 2525.172 ; gain = 204.438 ; free physical = 37321 ; free virtual = 106919
---------------------------------------------------------------------------------

Report Check Netlist: 
+------+------------------+-------+---------+-------+------------------+
|      |Item              |Errors |Warnings |Status |Description       |
+------+------------------+-------+---------+-------+------------------+
|1     |multi_driven_nets |      0|        0|Passed |Multi driven nets |
+------+------------------+-------+---------+-------+------------------+
---------------------------------------------------------------------------------
Start Handling Custom Attributes
---------------------------------------------------------------------------------
---------------------------------------------------------------------------------
Finished Handling Custom Attributes : Time (s): cpu = 00:00:03 ; elapsed = 00:00:06 . Memory (MB): peak = 2531.109 ; gain = 210.375 ; free physical = 37353 ; free virtual = 106951
---------------------------------------------------------------------------------
---------------------------------------------------------------------------------
Finished RTL Optimization Phase 1 : Time (s): cpu = 00:00:03 ; elapsed = 00:00:06 . Memory (MB): peak = 2531.109 ; gain = 210.375 ; free physical = 37353 ; free virtual = 106951
---------------------------------------------------------------------------------
Netlist sorting complete. Time (s): cpu = 00:00:00 ; elapsed = 00:00:00 . Memory (MB): peak = 2541.016 ; gain = 0.000 ; free physical = 37324 ; free virtual = 106936
INFO: [Netlist 29-17] Analyzing 1 Unisim elements for replacement
INFO: [Netlist 29-28] Unisim Transformation completed in 0 CPU seconds
INFO: [Project 1-570] Preparing netlist for logic optimization

Processing XDC Constraints
Initializing timing engine
Completed Processing XDC Constraints

Netlist sorting complete. Time (s): cpu = 00:00:00 ; elapsed = 00:00:00 . Memory (MB): peak = 2620.984 ; gain = 0.000 ; free physical = 37159 ; free virtual = 106760
INFO: [Project 1-111] Unisim Transformation Summary:
  A total of 1 instances were transformed.
  IBUFDS => IBUFDS (DIFFINBUF, IBUFCTRL): 1 instance 

WARNING: [Constraints 18-5210] No constraints selected for write.
Resolution: This message can indicate that there are no constraints for the design, or it can indicate that the used_in flags are set such that the constraints are ignored. This later case is used when running synth_design to not write synthesis constraints to the resulting checkpoint. Instead, project constraints are read when the synthesized design is opened.
Constraint Validation Runtime : Time (s): cpu = 00:00:00.05 ; elapsed = 00:00:00.12 . Memory (MB): peak = 2644.797 ; gain = 23.812 ; free physical = 37152 ; free virtual = 106754
load diablo GTM unisim library
---------------------------------------------------------------------------------
Finished Constraint Validation : Time (s): cpu = 00:00:06 ; elapsed = 00:00:13 . Memory (MB): peak = 2644.797 ; gain = 324.062 ; free physical = 37236 ; free virtual = 106838
---------------------------------------------------------------------------------
---------------------------------------------------------------------------------
Start Loading Part and Timing Information
---------------------------------------------------------------------------------
Loading part: xczu28dr-ffvg1517-2-e
INFO: [Synth 8-6742] Reading net delay rules and data
---------------------------------------------------------------------------------
Finished Loading Part and Timing Information : Time (s): cpu = 00:00:06 ; elapsed = 00:00:13 . Memory (MB): peak = 2644.797 ; gain = 324.062 ; free physical = 37235 ; free virtual = 106836
---------------------------------------------------------------------------------
---------------------------------------------------------------------------------
Start Applying 'set_property' XDC Constraints
---------------------------------------------------------------------------------
---------------------------------------------------------------------------------
Finished applying 'set_property' XDC Constraints : Time (s): cpu = 00:00:06 ; elapsed = 00:00:13 . Memory (MB): peak = 2644.797 ; gain = 324.062 ; free physical = 37234 ; free virtual = 106836
---------------------------------------------------------------------------------
---------------------------------------------------------------------------------
Finished RTL Optimization Phase 2 : Time (s): cpu = 00:00:07 ; elapsed = 00:00:13 . Memory (MB): peak = 2644.797 ; gain = 324.062 ; free physical = 37220 ; free virtual = 106825
---------------------------------------------------------------------------------

Report RTL Partitions: 
+-+--------------+------------+----------+
| |RTL Partition |Replication |Instances |
+-+--------------+------------+----------+
+-+--------------+------------+----------+
---------------------------------------------------------------------------------
Start RTL Component Statistics 
---------------------------------------------------------------------------------
Detailed RTL Component Info : 
+---Registers : 
	                1 Bit    Registers := 5     
+---Muxes : 
	   2 Input      1 Bit        Muxes := 1     
---------------------------------------------------------------------------------
Finished RTL Component Statistics 
---------------------------------------------------------------------------------
---------------------------------------------------------------------------------
Start RTL Hierarchical Component Statistics 
---------------------------------------------------------------------------------
Hierarchical RTL Component report 
Module pl_sysref 
Detailed RTL Component Info : 
+---Registers : 
	                1 Bit    Registers := 5     
+---Muxes : 
	   2 Input      1 Bit        Muxes := 1     
---------------------------------------------------------------------------------
Finished RTL Hierarchical Component Statistics
---------------------------------------------------------------------------------
---------------------------------------------------------------------------------
Start Part Resource Summary
---------------------------------------------------------------------------------
Part Resources:
DSPs: 4272 (col length:192)
BRAMs: 2160 (col length: RAMB18 192 RAMB36 96)
---------------------------------------------------------------------------------
Finished Part Resource Summary
---------------------------------------------------------------------------------
---------------------------------------------------------------------------------
Start Cross Boundary and Area Optimization
---------------------------------------------------------------------------------
Warning: Parallel synthesis criteria is not met 
---------------------------------------------------------------------------------
Finished Cross Boundary and Area Optimization : Time (s): cpu = 00:00:07 ; elapsed = 00:00:14 . Memory (MB): peak = 2644.797 ; gain = 324.062 ; free physical = 37220 ; free virtual = 106833
---------------------------------------------------------------------------------

Report RTL Partitions: 
+-+--------------+------------+----------+
| |RTL Partition |Replication |Instances |
+-+--------------+------------+----------+
+-+--------------+------------+----------+
---------------------------------------------------------------------------------
Start Applying XDC Timing Constraints
---------------------------------------------------------------------------------
---------------------------------------------------------------------------------
Finished Applying XDC Timing Constraints : Time (s): cpu = 00:00:23 ; elapsed = 00:00:44 . Memory (MB): peak = 3017.453 ; gain = 696.719 ; free physical = 34423 ; free virtual = 104082
---------------------------------------------------------------------------------
---------------------------------------------------------------------------------
Start Timing Optimization
---------------------------------------------------------------------------------
---------------------------------------------------------------------------------
Finished Timing Optimization : Time (s): cpu = 00:00:23 ; elapsed = 00:00:44 . Memory (MB): peak = 3017.453 ; gain = 696.719 ; free physical = 34423 ; free virtual = 104082
---------------------------------------------------------------------------------

Report RTL Partitions: 
+-+--------------+------------+----------+
| |RTL Partition |Replication |Instances |
+-+--------------+------------+----------+
+-+--------------+------------+----------+
---------------------------------------------------------------------------------
Start Technology Mapping
---------------------------------------------------------------------------------
---------------------------------------------------------------------------------
Finished Technology Mapping : Time (s): cpu = 00:00:23 ; elapsed = 00:00:44 . Memory (MB): peak = 3026.469 ; gain = 705.734 ; free physical = 34388 ; free virtual = 104046
---------------------------------------------------------------------------------

Report RTL Partitions: 
+-+--------------+------------+----------+
| |RTL Partition |Replication |Instances |
+-+--------------+------------+----------+
+-+--------------+------------+----------+
---------------------------------------------------------------------------------
Start IO Insertion
---------------------------------------------------------------------------------
---------------------------------------------------------------------------------
Start Flattening Before IO Insertion
---------------------------------------------------------------------------------
---------------------------------------------------------------------------------
Finished Flattening Before IO Insertion
---------------------------------------------------------------------------------
---------------------------------------------------------------------------------
Start Final Netlist Cleanup
---------------------------------------------------------------------------------
---------------------------------------------------------------------------------
Finished Final Netlist Cleanup
---------------------------------------------------------------------------------
---------------------------------------------------------------------------------
Finished IO Insertion : Time (s): cpu = 00:00:23 ; elapsed = 00:00:45 . Memory (MB): peak = 3042.312 ; gain = 721.578 ; free physical = 34402 ; free virtual = 104060
---------------------------------------------------------------------------------
---------------------------------------------------------------------------------
Start Renaming Generated Instances
---------------------------------------------------------------------------------
---------------------------------------------------------------------------------
Finished Renaming Generated Instances : Time (s): cpu = 00:00:23 ; elapsed = 00:00:45 . Memory (MB): peak = 3042.312 ; gain = 721.578 ; free physical = 34402 ; free virtual = 104060
---------------------------------------------------------------------------------

Report RTL Partitions: 
+-+--------------+------------+----------+
| |RTL Partition |Replication |Instances |
+-+--------------+------------+----------+
+-+--------------+------------+----------+

Report Check Netlist: 
+------+------------------+-------+---------+-------+------------------+
|      |Item              |Errors |Warnings |Status |Description       |
+------+------------------+-------+---------+-------+------------------+
|1     |multi_driven_nets |      0|        0|Passed |Multi driven nets |
+------+------------------+-------+---------+-------+------------------+
---------------------------------------------------------------------------------
Start Rebuilding User Hierarchy
---------------------------------------------------------------------------------
---------------------------------------------------------------------------------
Finished Rebuilding User Hierarchy : Time (s): cpu = 00:00:23 ; elapsed = 00:00:45 . Memory (MB): peak = 3042.312 ; gain = 721.578 ; free physical = 34402 ; free virtual = 104060
---------------------------------------------------------------------------------
---------------------------------------------------------------------------------
Start Renaming Generated Ports
---------------------------------------------------------------------------------
---------------------------------------------------------------------------------
Finished Renaming Generated Ports : Time (s): cpu = 00:00:23 ; elapsed = 00:00:45 . Memory (MB): peak = 3042.312 ; gain = 721.578 ; free physical = 34402 ; free virtual = 104060
---------------------------------------------------------------------------------
---------------------------------------------------------------------------------
Start Handling Custom Attributes
---------------------------------------------------------------------------------
---------------------------------------------------------------------------------
Finished Handling Custom Attributes : Time (s): cpu = 00:00:23 ; elapsed = 00:00:45 . Memory (MB): peak = 3042.312 ; gain = 721.578 ; free physical = 34402 ; free virtual = 104060
---------------------------------------------------------------------------------
---------------------------------------------------------------------------------
Start Renaming Generated Nets
---------------------------------------------------------------------------------
---------------------------------------------------------------------------------
Finished Renaming Generated Nets : Time (s): cpu = 00:00:23 ; elapsed = 00:00:45 . Memory (MB): peak = 3042.312 ; gain = 721.578 ; free physical = 34402 ; free virtual = 104060
---------------------------------------------------------------------------------
---------------------------------------------------------------------------------
Start Writing Synthesis Report
---------------------------------------------------------------------------------

Report BlackBoxes: 
+-+--------------+----------+
| |BlackBox name |Instances |
+-+--------------+----------+
+-+--------------+----------+

Report Cell Usage: 
+------+-------+------+
|      |Cell   |Count |
+------+-------+------+
|1     |IDDRE1 |     1|
|2     |LUT3   |     1|
|3     |FDRE   |     5|
|4     |IBUFDS |     1|
+------+-------+------+

Report Instance Areas: 
+------+---------+----------+------+
|      |Instance |Module    |Cells |
+------+---------+----------+------+
|1     |top      |          |     8|
|2     |  inst   |pl_sysref |     8|
+------+---------+----------+------+
---------------------------------------------------------------------------------
Finished Writing Synthesis Report : Time (s): cpu = 00:00:23 ; elapsed = 00:00:45 . Memory (MB): peak = 3042.312 ; gain = 721.578 ; free physical = 34402 ; free virtual = 104060
---------------------------------------------------------------------------------
Synthesis finished with 0 errors, 0 critical warnings and 0 warnings.
Synthesis Optimization Runtime : Time (s): cpu = 00:00:21 ; elapsed = 00:00:40 . Memory (MB): peak = 3042.312 ; gain = 607.891 ; free physical = 34417 ; free virtual = 104075
Synthesis Optimization Complete : Time (s): cpu = 00:00:23 ; elapsed = 00:00:45 . Memory (MB): peak = 3042.320 ; gain = 721.578 ; free physical = 34417 ; free virtual = 104075
INFO: [Project 1-571] Translating synthesized netlist
Netlist sorting complete. Time (s): cpu = 00:00:00 ; elapsed = 00:00:00 . Memory (MB): peak = 3042.320 ; gain = 0.000 ; free physical = 34419 ; free virtual = 104077
INFO: [Netlist 29-17] Analyzing 1 Unisim elements for replacement
INFO: [Netlist 29-28] Unisim Transformation completed in 0 CPU seconds
INFO: [Project 1-570] Preparing netlist for logic optimization
INFO: [Opt 31-138] Pushed 0 inverter(s) to 0 load pin(s).
Netlist sorting complete. Time (s): cpu = 00:00:00 ; elapsed = 00:00:00 . Memory (MB): peak = 3081.969 ; gain = 0.000 ; free physical = 34094 ; free virtual = 103755
INFO: [Project 1-111] Unisim Transformation Summary:
  A total of 1 instances were transformed.
  IBUFDS => IBUFDS (DIFFINBUF, IBUFCTRL): 1 instance 

INFO: [Common 17-83] Releasing license: Synthesis
28 Infos, 2 Warnings, 0 Critical Warnings and 0 Errors encountered.
synth_design completed successfully
synth_design: Time (s): cpu = 00:00:31 ; elapsed = 00:01:18 . Memory (MB): peak = 3081.969 ; gain = 1583.699 ; free physical = 34144 ; free virtual = 103804
Netlist sorting complete. Time (s): cpu = 00:00:00 ; elapsed = 00:00:00 . Memory (MB): peak = 3081.969 ; gain = 0.000 ; free physical = 34144 ; free virtual = 103804
WARNING: [Constraints 18-5210] No constraints selected for write.
Resolution: This message can indicate that there are no constraints for the design, or it can indicate that the used_in flags are set such that the constraints are ignored. This later case is used when running synth_design to not write synthesis constraints to the resulting checkpoint. Instead, project constraints are read when the synthesized design is opened.
INFO: [Common 17-1381] The checkpoint '/home/wisig/Videos/MTS/RFSoC-MTS/mts/mts.runs/design_1_pl_sysref_0_0_synth_1/design_1_pl_sysref_0_0.dcp' has been generated.
WARNING: [Common 17-576] 'use_project_ipc' is deprecated. This option is deprecated and no longer used.
Netlist sorting complete. Time (s): cpu = 00:00:00 ; elapsed = 00:00:00 . Memory (MB): peak = 3081.969 ; gain = 0.000 ; free physical = 34264 ; free virtual = 103926
WARNING: [Constraints 18-5210] No constraints selected for write.
Resolution: This message can indicate that there are no constraints for the design, or it can indicate that the used_in flags are set such that the constraints are ignored. This later case is used when running synth_design to not write synthesis constraints to the resulting checkpoint. Instead, project constraints are read when the synthesized design is opened.
INFO: [Common 17-1381] The checkpoint '/home/wisig/Videos/MTS/RFSoC-MTS/mts/mts.runs/design_1_pl_sysref_0_0_synth_1/design_1_pl_sysref_0_0.dcp' has been generated.
INFO: [runtcl-4] Executing : report_utilization -file design_1_pl_sysref_0_0_utilization_synth.rpt -pb design_1_pl_sysref_0_0_utilization_synth.pb
INFO: [Common 17-206] Exiting Vivado at Sun Sep 21 13:03:06 2025...
